Date,City,State,Dead,Injured,Total,Description
16-06-2019,Des Moines,Iowa,0,6,6,Six people were shot in a drive-by shooting while standing in the street after a party.
15-06-2019,West Des Moines,Iowa,4,0,4,"Three relatives, two children and two adults, were found dead from gunshot wounds in a house."
15-06-2019,Shreveport,Louisiana,0,4,4,Four people were wounded in a drive-by shooting outside of a nightclub.
12-06-2019,Pensacola,Florida,4,8,12,Naval Air Station Pensacola shooting: A man killed three individuals and injured eight more at Naval Air Station Pensacola before being killed by police. A terrorist motive is suspected to be behind the attack.
10-06-2019,Kansas City,Kansas,4,5,9,Four people were killed and another five people wounded in a shooting at a bar.
10-06-2019,Evansville,Indiana,0,5,5,"An argument inside of an American Legion bar escalated, and five men were shot as they left the bar."
10-06-2019,Denver,Colorado,0,4,4,"An argument escalated during a large gathering outside a home, and four people were wounded."
09-06-2019,Saint Croix,United States Virgin Isls,0,4,4,Four people were shot at a housing community.
08-06-2019,Detroit,Michigan,0,4,4,Four people were shot and injured after a dispute.
08-06-2019,Stone Mountain,Georgia,4,0,4,"A man killed two women and a man, before killing himself in a triple murder–suicide."
07-06-2019,Charlotte,North Carolina,0,4,4,Four people were shot in a McDonald's parking lot after a dispute involving a rideshare vehicle.
07-06-2019,St. Clair Shores,Michigan,2,2,4,"After a dispute over fireworks, a man shot into a crowd and injured a 12-year-old child and a woman, then barricaded himself in his home. Police discovered him and a woman deceased in the home."
07-06-2019,San Jose,California,0,4,4,"Four people were discovered wounded by police, who responded to a shots fired call; the victims had driven away from the initial scene."
06-06-2019,Chicago,Illinois,1,3,4,One man was killed and three others wounded when a secondary vehicle pulled up next to vehicle and opened fire on Lake Shore Drive.
04-06-2019,Tallahassee,Florida,0,4,4,Four Florida A&M University students were injured in a shooting following an argument at a house party.
04-06-2019,Chicago,Illinois,0,6,6,At least six people were injured in a shooting at a baby shower.
02-06-2019,Cleveland,Ohio,1,3,4,One man was killed and three others were injured after a shooting broke out in Cleveland's Clark–Fulton neighborhood.
02-06-2019,New York City,New York,1,3,4,A man was killed and three others were injured after a shooting in the lobby of an apartment building around 10:30 pm ET.
01-06-2019,Roswell,New Mexico,0,4,4,A man injured four people in a shooting following an argument at a party. He was arrested the same day.
31-05-2019,Virginia Beach,Virginia,13,4,17,2019 Virginia Beach shooting: A gunman killed 12 people and injured four others at a city public works building. The gunman died at the scene after being shot by police.
30-05-2019,Robbins,Illinois,0,5,5,Five people were wounded after a vehicle pulled up to a large gathering and opened fire.
29-05-2019,Cleveland,Texas,2,3,5,"A man shot three employees at a local plumbing company, killing one before exchanging gunfire with a sheriff's deputy, also injuring him before committing suicide."
27-05-2019,Trenton,New Jersey,1,5,6,"Police responded to a shooting on Walnut Avenue, and found one teenager deceased and five adults injured."
27-05-2019,Washington D.C.,Washington D.C.,0,5,5,A boy and four others were wounded in a shooting in the Barry Farm neighborhood.
26-05-2019,Washington D.C.,Washington D.C.,1,3,4,One teenager was killed and two women and a child were injured after being shot in a parking lot.
26-05-2019,Chicago,Illinois,2,3,5,"Several people were gathered outside of a party when a man opened fire, killing two and wounding three."
26-05-2019,Stockton,California,1,3,4,Police discovered one person deceased and three injured after responding to reports of a shooting.
26-05-2019,La Crosse,Virginia,0,5,5,"Multiple shooters reportedly opened fire at a block party, injuring five people."
25-05-2019,Chesapeake,Virginia,1,9,10,"Police responded to a noise complaint at a large party, and discovered ten people with gunshot wounds. One later died from their injuries."
25-05-2019,Baltimore,Maryl,0,4,4,"Four people, including a teenager were found shot in McElderry Park."
25-05-2019,Oklahoma City,Oklahoma,0,5,5,"Five people were wounded in a parking lot, after an SUV pulled up and its occupants began shooting."
25-05-2019,Trenton,New Jersey,0,10,10,Ten people were wounded in a shooting at a bar.
20-05-2019,Alexandria,Louisiana,1,4,5,One teenager was killed and five were injured in a shooting.
20-05-2019,Tulsa,Oklahoma,2,2,4,"A man opened fire on a group of people, killing two and wounding two others at an apartment complex."
20-05-2019,Columbus,Ohio,0,4,4,Four people were injured in a shooting in the Hilltop neighborhood.
19-05-2019,Portland,Oregon,0,5,5,Five people were wounded after gunfire erupted at a warehouse party.
18-05-2019,Long Beach,California,1,5,6,A 57-year-old woman was killed and five others were wounded during a vigil at a local bar.
18-05-2019,Cascilla,Mississippi,1,5,6,One person was killed and five were injured in a shooting during a family dispute.
18-05-2019,Muncie,Indiana,0,7,7,Seven people were wounded at a house party near the campus of Ball State University.
18-05-2019,Winston-Salem,North Carolina,1,5,6,One man was killed and five were wounded at an overnight block party.
18-05-2019,Cedar Rapids,Iowa,2,2,4,Two people were killed and two were wounded after an assailant shot into a vehicle outside of a tobacco store.
18-05-2019,Atmore,Alabama,1,8,9,One person was killed and eight were wounded at a high school graduation party when a gunman opened fire during a fight.
17-05-2019,Sacramento,California,1,4,5,"A woman and three others, including a 4-year-old boy were wounded in what police presume was a targeted shooting. One of the victims later died from their injuries."
16-05-2019,Cleveland,Ohio,0,4,4,"Four people, including two teenagers were wounded in a shooting."
15-05-2019,St. Rose,Louisiana,0,4,4,"Four people, including two children were wounded during an altercation between two men in a strip mall parking lot."
13-05-2019,St. Louis,Missouri,4,1,5,"Three people were killed and two were critically injured in a shooting at a home. One victim died of their injuries days later, taking the death toll to four."
13-05-2019,New Orleans,Louisiana,0,4,4,Three men and a teenager were wounded in a drive-by shooting in the Central City neighborhood.
12-05-2019,Miramar,Florida,4,1,5,"2019 Miramar shootout: Four people are dead and one injured after a pair of men rob a jewelry store in Coral Gables, injuring the clerk, then carjack a UPS truck and lead police on a chase that ended in a shootout in Miramar that killed the UPS driver, a bystander, and the suspects."
10-05-2019,Lawton,Oklahoma,4,0,4,Two adults and two children were discovered dead in a home.
08-05-2019,Suitland,Maryl,1,3,4,One person was killed and three were wounded after a large fight broke out following a funeral service.
08-05-2019,New York City,New York,0,4,4,Four people were injured in a shooting during a candlelight vigil in Crown Heights.
08-05-2019,San Antonio,Texas,4,0,4,"A man killed his uncle, grandmother and mother before he set the house on fire and committed suicide in a triple murder–suicide."
07-05-2019,Chicago,Illinois,0,5,5,Five people were wounded in a shooting in Chicago's Woodlawn community.
07-05-2019,Reno,Nevada,1,3,4,One person died and three were wounded in a shooting.
07-05-2019,New York City,New York,0,4,4,A gunman opened fire — injuring four people in the East New York neighborhood.
07-05-2019,Boston,Massachusetts,0,6,6,Six people were wounded in Boston's Roxbury neighborhood.
07-05-2019,Gravette,Arkansas,4,0,4,"Four people were found deceased at a home in an apparent murder–suicide. The deaths consisted of two young males, and one middle aged female, not including the perpetrator who killed himself afterwards."
06-05-2019,Santa Rosa,California,0,4,4,"A teenager opened fire at a soccer park, wounding an 11-year-old boy and three others."
05-05-2019,North Bergen,New Jersey,1,4,5,"Just before 4 am, officers discovered one person deceased and four people wounded, after a fight potentially escalated."
05-05-2019,Oceano,California,0,6,6,Officers responded to a call and discovered six individuals wounded by gunfire; the victims were transported to local hospitals for treatment.
02-05-2019,San Antonio,Texas,2,2,4,"A man and woman were killed and two others injured after the shooter kicked open an apartment door and shot inside, before fleeing."
30-04-2019,Charlotte,North Carolina,2,4,6,"University of North Carolina at Charlotte shooting: Six people were shot, two fatally, on the last day of classes at the University of North Carolina at Charlotte. The student gunman was taken into custody after he was tackled by one of the students in the classroom. He had several more loaded magazines in a backpack."
28-04-2019,Nashville,Tennessee,0,7,7,Two men got into an altercation at a party and exchanged gunfire; seven people were wounded in the crossfire.
28-04-2019,Birmingham,Alabama,0,4,4,"A suspect in a vehicle opened fire on patrons outside of a nightclub, injuring four."
28-04-2019,Baltimore,Maryl,1,7,8,One person was killed and seven were wounded when a gunman opened fire on two cookouts at an intersection.
28-04-2019,West Chester Township,Ohio,4,0,4,"Four family members, three women and one man, were found shot to death in an apartment. The suspect remains at large."
27-04-2019,Jackson,Mississippi,1,3,4,One person was killed and three were injured in a shooting in south Jackson.
27-04-2019,Jackson,Michigan,0,4,4,Four people were wounded in an overnight shooting.
27-04-2019,Poway,California,1,3,4,Poway synagogue shooting: One person was killed and at least three were wounded by a shooter at the Chabad of Poway synagogue.
26-04-2019,Hugo,Oklahoma,0,4,4,"Investigators attempted to make contact with the suspect in relation to another crime, he then began to open fire, injuring three children and himself."
21-04-2019,Philadelphia,Pennsylvania,0,4,4,Four people were wounded in the Grays Ferry Section of the city.
21-04-2019,Los Angeles,California,0,4,4,Four seniors were wounded by gunfire after a suspect opened fire in the vehicle behind them.
20-04-2019,Corpus Christi,Texas,0,4,4,A disturbance in a neighborhood escalated into a shooting; four men were wounded.
20-04-2019,Memphis,Tennessee,0,7,7,Seven people were wounded in a shooting that police believe occurred after a large fight.
19-04-2019,Wichita,Kansas,0,4,4,"Two suspects fired multiple shots at people attending a party, injuring four."
18-04-2019,Louisville,Kentucky,0,4,4,Four people in a vehicle were wounded when they were shot at by at least one person in another car.
16-04-2019,Germantown,Maryl,1,3,4,A drive-by shooting killed an 18-year-old male and wounded three other men in a cul-de-sac.
14-04-2019,Miami,Florida,2,2,4,Two women were killed and another man and woman were wounded in a drive-by shooting outside of Miami's Liberty City neighborhood.
14-04-2019,Valleho,California,1,3,4,One man was killed and three were injured in an early morning shooting.
14-04-2019,Stockton,California,0,4,4,"A man opened fire inside of a bar following a disturbance, wounding four patrons."
12-04-2019,Pearl Harbor,Hawaii,3,1,4,"22-year-old Gabriel Romero, a US Navy sailor and submarine crewman, randomly opened fire just minutes after starting his shift for routine guard duty at at Joint Base Pearl Harbor–Hickam. He opened fire on a group of civilian workers, killing two and wounded another, before immediately shooting himself. The motive is thought to be a toxic cultural environment in the USN, particularly among submarine crewman."
12-04-2019,Montgomery,Alabama,2,2,4,Two people were killed and two wounded in an apartment complex.
11-04-2019,Houston,Texas,1,3,4,A man was killed and three other people were injured when a person opened fire at a group in a driveway.
09-04-2019,Marrero,Louisiana,2,2,4,"A man and a seven-year-old girl were killed, and another man and a 11-year-old boy were injured after an argument apparently escalated."
09-04-2019,Jacksonville,Florida,0,4,4,Three adults and a child were wounded in a shooting.
08-04-2019,Chicago,Illinois,0,7,7,Seven people were wounded in a drive-by shooting near Douglass Park.
08-04-2019,Dayton,Ohio,10,27,37,"2019 Dayton shooting: A gunman killed nine people and injured 27 outside of a bar after he was denied entry, before being killed by police."
08-04-2019,Memphis,Tennessee,1,3,4,One man was killed and three others were injured in an early morning shooting.
08-04-2019,Chicago,Illinois,1,7,8,One person was killed and seven others were injured in a shooting in the Lawndale community.
08-04-2019,Grenada,Mississippi,0,4,4,Four people were discovered wounded in an overnight shooting.
07-04-2019,Chicago,Illinois,1,3,4,"One man was killed and three were wounded, after a suspect opened fire from a vehicle."
07-04-2019,Los Angeles,California,0,4,4,"Four people, including a 15-year-old girl were wounded, after two perpetrators opened fire in the Historic South-Central neighborhood."
07-04-2019,Rockford,Illinois,0,4,4,Four people were wounded after an argument escalated.
07-04-2019,Fresno,California,1,3,4,One person was killed and three were injured after gunfire erupted at an Independence Day celebration.
05-04-2019,Indianapolis,Indiana,0,4,4,Three teens and one man were injured after a fight involving between 20 and 30 individuals.
05-04-2019,Wilmington,Delaware,0,4,4,Four people were wounded in a shooting at West 27th and Tatnall Streets.
05-04-2019,St. Louis,Missouri,1,4,5,Five people were shot inside of a vehicle; the incident resulted in one death and four injuries.
04-04-2019,Panama City,Florida,1,3,4,One person was killed and three were found with gunshot injuries in Panama City.
04-04-2019,Stockbridge,Georgia,3,2,5,Two officers responding to a suspected hostage situation were wounded and three individuals were later found deceased in a murder–suicide.
02-04-2019,Baton Rouge,Louisiana,0,4,4,Four people were wounded in an early morning shooting.
02-04-2019,Washington D.C.,Washington D.C.,0,5,5,Four men and an elementary-school-age girl were injured in a shooting at a bus stop.
01-04-2019,Torrance,California,3,4,7,"An argument at the Torrance bowling alley escalated into a fight and three people were killed by gunshots, at least four others were wounded. A suspect who was out of prison on parole has been arrested."
01-04-2019,Houston,Texas,1,3,4,A man injured his brother and two friends before being killed by a police officer.
01-04-2019,Hurt,Virginia,3,2,5,A man killed his wife and son in their home and injured two people who were inside a vehicle before killing himself.
31-03-2019,North Charleston,South Carolina,0,7,7,Seven people were wounded in a shooting at an overnight house party.
31-03-2019,Atlanta,Georgia,1,4,5,One person was killed and four were wounded during a house party.
31-03-2019,Chicago,Illinois,1,4,5,One person was killed and four people were wounded in a shooting in East Garfield Park.
28-03-2019,Baltimore,Maryl,0,4,4,Four people were wounded in a shooting near a playground.
25-03-2019,North Las Vegas,Nevada,0,5,5,An after-school fight led to a shooting in a neighborhood; five teenagers were wounded.
24-03-2019,Phoenix,Arizona,0,7,7,"During a warehouse party, a fight broke out and escalated into a shooting; seven people were wounded."
24-03-2019,San Francisco,California,1,5,6,A shooting occurred near the Fillmore Heritage Center around 8:40 pm local time; one person was killed and five others were injured.
19-03-2019,Phoenix,Arizona,2,4,6,An argument at a house party ended in a shooting when the perpetrator returned to the party and killed two and wounded four before fleeing.
17-03-2019,Rochelle,Georgia,1,3,4,"In the early morning, two groups were involved in a dispute, which ended with one person killed and three people wounded."
17-03-2019,Las Vegas,Nevada,0,4,4,Four people were wounded at the El Cortez Hotel and Casino in an early morning shooting. The suspect was later arrested.
17-03-2019,Augusta,Georgia,0,4,4,"Four people were wounded after an argument, although the shooter claims that it was in self-defense to being randomly attacked."
16-03-2019,Camden,New Jersey,1,3,4,"One man was killed and three others were wounded following a shooting at a ""residential speakeasy""."
15-03-2019,Mobile,Alabama,2,3,5,Two men were killed and three others were wounded in an overnight shooting behind a home. The suspect was arrested the next day.
14-03-2019,Missoula,Montana,1,3,4,"One person was fatally shot and three others were wounded, including a Montana Highway Patrol trooper following a road rage incident."
13-03-2019,Harvey,Illinois,1,3,4,One person was killed and three were wounded after gunfire erupted in a nightclub.
11-03-2019,Nacogdoches,Texas,1,3,4,"A man shot at five men working on a barn, killing one and injured three others."
11-03-2019,Toledo,Ohio,0,4,4,Officers responding to a Shotspotter alert found four people wounded at a nightclub.
10-03-2019,Roxboro,North Carolina,1,3,4,A man was killed and three others wounded.
10-03-2019,Marshall,Missouri,1,3,4,Three people were wounded and a fourth later died at the hospital in a shooting.
08-03-2019,El Paso,Texas,23,23,46,2019 El Paso shooting: 23 people were killed and 23 were injured at a Walmart near the Cielo Vista Mall in a Hispanophobic massacre. The perpetrator was taken into custody.
07-03-2019,Katy,Texas,2,3,5,The perpetrator shot and killed his sister and three others at a housewarming party. He later died at a hospital.
05-03-2019,Dallas,Texas,1,3,4,Four men were discovered shot at Cherrywood Park after a drive-by shooting; one of the victims died from their injuries.
05-03-2019,Baltimore,Maryl,0,4,4,Four people were injured and discovered after a Shot Spotter gunfire alert notified police to the location.
05-03-2019,Baltimore,Maryl,0,5,5,"Emergency responders discovered a female and two young children injured, and two men were later identified as being wounded in the same incident."
03-03-2019,Oakland,California,0,4,4,Four people were injured in a shooting at a sports bar following a fight.
03-03-2019,Chicago,Illinois,0,6,6,Six people were injured in a shooting at a bar following a fight.
02-03-2019,Chicago,Illinois,2,5,7,"Around 2 am local time, two people were killed and five people were wounded in a drive-by shooting after a fight outside of a club."
01-03-2019,Texas City,Texas,3,1,4,Three children under the age of six were found deceased along with a wounded woman in an apparent home invasion.
28-02-2019,Joliet,Illinois,4,0,4,Two adults and their 6 and 1-year-old children were killed in an apparent murder suicide.
28-02-2019,Oakland,California,1,4,5,One person was killed and four others were wounded in a shooting near a gas station.
22-02-2019,Birmingham,Alabama,2,2,4,Two people were killed and two were injured in a shooting at a party in a home.
21-02-2019,Elizabeth,Kentucky,2,2,4,Two people were killed and two others were found wounded in two separate shootings believed to be perpetrated by the same man.
21-02-2019,Baltimore,Maryl,1,4,5,"Officers on patrol responded to gunshots, and upon investigation discovered a deceased male and four wounded victims."
21-02-2019,Houston,Texas,2,2,4,A gunman perched on the roof of a home killed two and wounded two after an argument led to the incident.
20-02-2019,Covington,Tennessee,0,4,4,Three adults and a teenager were injured inside a home in a presumed targeted shooting.
18-02-2019,Solon Township,Michigan,4,0,4,"A 28-year-old woman killed her three children, ages 8, 6 and 2, before killing herself."
17-02-2019,New Orleans,Louisiana,1,5,6,"After police attempted to arrest a suspect, a gunfight broke out, and led to one person being killed and five being wounded."
17-02-2019,Evansville,Indiana,0,5,5,Five people were wounded after shots were fired outside of a bar. Two suspects were taken into custody by police.
17-02-2019,Henderson,Texas,2,2,4,"Two people were wounded and two were killed in a shooting at an apartment complex. The suspect was later arrested in Bienville Parish, Louisiana."
16-02-2019,Clinton,Mississippi,4,0,5,"Police responded to a domestic dispute at a residence; upon arrival, the suspect fired shots at officers leading to a 12-hour hostage standoff. Four people were killed, and the suspect was taken into custody and later died."
15-02-2019,Aurora,Illinois,6,6,12,"Aurora, Illinois shooting: A man opened fire in his workplace, killing five employees, and injuring five police officers and a civilian before being killed by police."
14-02-2019,Jacksonville,Florida,2,2,4,"After a fight broke out near a basketball court at a park, multiple people started shooting at each other. Two people were killed, and two were wounded."
11-02-2019,Baton Rouge,Louisiana,0,4,4,Four people were wounded in a shooting.
11-02-2019,Detroit,Michigan,1,4,5,One person was killed and five injured at an after hours party.
09-02-2019,Chicago,Illinois,0,4,4,Four men were wounded in a drive-by shooting outside of a CTA Green Line station in Washington Park.
09-02-2019,Elkmont,Alabama,5,0,5,A 14-year-old boy shot dead five family members – two adults and three children – in an Alabama residence. He confessed the crime to the police.
09-02-2019,Greensboro,North Carolina,2,2,4,Two men were killed and a woman and small child injured during a home invasion.
08-02-2019,Pomfret,Maryl,3,1,4,"A man shot and killed his in-laws, and wounded an 11-year-old boy sitting in a relative's car before committing suicide."
08-02-2019,Suffolk,Virginia,2,3,5,"Two men were killed, and two women and a two-year-old were wounded at multiple crime scenes."
07-02-2019,Washington Park,Illinois,0,4,4,"A 16-year-old, 12-year-old and an adult were injured when an argument over fireworks escalated. The perpetrator was shot by a by-stander."
07-02-2019,Wellston,Missouri,0,4,4,Four people were injured in a drive-by shooting just before midnight near a local food store.
04-02-2019,Hermanville,Mississippi,0,4,4,A man shot four people in a drive-by shooting outside of a convenience store.
04-02-2019,Covington,Kentucky,0,5,5,Five people were wounded in a drive-by shooting at an intersection.
03-02-2019,Pine Bluff,Arkansas,1,4,5,One person was killed and four other were wounded at a party when shots were fired into a home.
01-02-2019,Jonesboro,Arkansas,1,3,4,A 16-year-old boy was killed and three others were wounded during a home invasion.
28-01-2019,Houston,Texas,2,4,6,Pecan Park Raid: Four police officers were shot while serving a warrant in southeast Houston. The two homeowners were killed.
27-01-2019,Birmingham,Alabama,0,5,5,"Police responded to a call and discovered five people with gunshot wounds, along with two of the victims sustaining life-threatening injuries."
26-01-2019,Albany,Georgia,0,4,4,"Two people were found with bullet wounds in front of a residence, and two more arrived at a hospital with gunshot injuries from the same shooting."
26-01-2019,Indianapolis,Indiana,0,5,5,"A man was asked to leave a bar; shortly after, he came back and shot five people, critically wounding two."
26-01-2019,Ascension Parish and Livingston Parish,Louisiana,5,0,5,"January 2019 Louisiana shootings: A 21-year-old man killed five people, including his parents, in two parishes in Louisiana. The suspect fled to Virginia and was arrested the next day."
26-01-2019,Newark,New Jersey,1,3,4,"A gunman opened fire on individuals attending a candlelight vigil, killing one, and wounding three others."
24-01-2019,State College,Pennsylvania,4,1,5,"A man killed two people and injured one inside a local bar, then drove away and broke into a home and killed the homeowner before killing himself."
24-01-2019,Rockmart,Georgia,4,1,5,A man killed four individuals and injured another in two separate shootings.
23-01-2019,Sebring,Florida,5,0,5,2019 Sebring shooting: At least five people were killed in a hostage incident and shooting at a bank. The suspect was taken into custody by police.
20-01-2019,Miami,Florida,0,4,4,Three adults and a child were wounded in a shooting while attending a block party.
19-01-2019,Gaffney,South Carolina,1,4,5,One person was killed and four others were wounded in a shooting at a nightclub.
19-01-2019,Chicago,Illinois,0,4,4,"Early in the morning, three women and a man were involved in a fight and were injured in the ensuing shooting."
19-01-2019,Lebanon,Pennsylvania,0,4,4,"In an apparent targeted shooting, four individuals were discovered shot in a building."
19-01-2019,Houston,Texas,3,2,5,Three people were killed and two more were injured by a homeowner in a possible attempted home invasion.
19-01-2019,Jacksonville,Florida,3,2,5,A man killed two people and injured two more before killing himself.
17-01-2019,Owensboro,Kentucky,3,1,4,Three people were killed and another person was wounded in a shooting at a home. Two men were arrested in relation to the shooting.
16-01-2019,Jacksonville,Florida,1,5,6,"A man was killed and five other people were injured in a shooting. The Mayor of Jacksonville described the shooting as gang-related, although this characterization has been disputed by the sister of the deceased man."
16-01-2019,Palmdale,California,3,1,4,Three people were killed and another one was wounded in a shooting.
15-01-2019,Little Rock,Arkansas,1,4,5,"An argument over a gun inside a local ice cream shop led to a shooting. One man was killed and four others, including the suspected shooter, were injured."
