Date,City,State,Dead,Injured,Total,Description
31-07-2022,Decatur,Illinois,1,3,4,"Four teenagers, one of whom died, were shot at the end of a graduation party at a brewpub."
31-07-2022,Hartford,Connecticut,0,4,4,"Four people, including a teenager, were shot in the Clay Arsenal neighborhood."
31-07-2022,Indianapolis,Indiana,0,4,4,Four people were shot after a fight in the Broad Ripple neighborhood during the early morning.
31-07-2022,Detroit,Michigan,1,7,8,"One person was killed, and seven others were injured during a shooting in the northwest part of the city in the early morning."
31-07-2022,Orlando,Florida,0,7,7,Seven people were shot when someone opened fire into a crowd during a fight in the Central Business District during the early morning.
31-07-2022,South Bend,Indiana,0,4,4,A person shot four people in two different locations who were later transferred to hospitals. No motive has been established.
30-07-2022,Wheeling,Illinois,0,5,5,"Following an argument at a bar earlier in the morning between two groups, one of the groups opened fire at the residence the other group was at, leaving five injured."
30-07-2022,Girard,Georgia,1,4,5,"Multiple people opened fire during a party at an unlicensed bar, leaving one dead and four others injured."
30-07-2022,Monroe,Louisiana,1,3,4,"A teenager was killed, and three other people were injured when multiple people opened fire on a group outside an apartment."
29-07-2022,Cleveland,Ohio,1,3,4,"One person was killed, and three others were injured in a shooting at an intersection between the Corlett and Lee-Miles neighborhoods."
29-07-2022,Albuquerque,New Mexico,1,4,5,"A teenager was killed, and four other people were hurt during a shooting in the northwest part of the city."
29-07-2022,Goulds,Florida,0,4,4,A shooting at an apartment complex injured four teenagers. Two of the victims were airlifted to a nearby children's hospital.
29-07-2022,Baltimore,Maryl,2,2,4,"An argument in the Walbrook neighborhood led to at least one person opening fire, killing two and injuring two others. The suspects carjacked a vehicle in an attempt to escape before crashing the car into another vehicle."
27-07-2022,Farmers Loop,Alaska,4,0,4,"A teenager killed three of his siblings and then himself, while the parents and a fifth sibling were not at home at the time of the shooting."
27-07-2022,Hahnville,Louisiana,1,3,4,"Four people were shot in a residential neighborhood, one of whom died."
26-07-2022,Macon,Georgia,2,2,4,"Four people, including three teenagers, were shot outside a townhome in the northwest part of the city. One teenager and one adult died."
25-07-2022,New Orleans,Louisiana,0,4,4,Four men walking along the road in the Faubourg Lafayette neighborhood were shot shortly after midnight.
24-07-2022,Dallas,Texas,1,3,4,"An argument among a group of people led to a man opening fire in the city's Northwest side, killing another man, and injuring two teens before being shot by one of the victims."
24-07-2022,Harmony Township,Ohio,3,1,4,"When concerned family members checked on a man at his trailer home, they were met with gunfire, with the man fatally shooting his mother and injuring another woman. Responding police entered the trailer and were fired upon, leaving one deputy dead and another suffering a non-gunshot injury to the leg. The man killed himself, and the trailer home burned down."
24-07-2022,Los Angeles,California,2,5,7,Two people were killed and five others injured during a shooting at a car show in Peck Park in the San Pedro neighborhood.
24-07-2022,Fort Worth,Texas,1,3,4,One person was killed and three others injured after a shooting in the Meadowbrook neighborhood.
24-07-2022,Atlanta,Georgia,0,8,8,"Eight people, including at least two teenagers, were shot during a drive-by shooting at a Shell gas station in the Loring Heights neighborhood."
24-07-2022,Bennettsville,South Carolina,1,3,4,One person was killed and three others injured during a shooting at a nightclub.
23-07-2022,Richmond,Virginia,0,5,5,Five men were shot in the McGuire Manor neighborhood shortly before midnight.
23-07-2022,Chicago,Illinois,0,4,4,"Shortly before midnight, a man opened fire on a group of people in the Back of the Yards neighborhood, leaving four injured."
23-07-2022,El Paso,Texas,0,4,4,Four people were shot during a large party at a home in the east side during the early morning.
23-07-2022,Chicago,Illinois,0,4,4,"A man got out of a black truck and opened fire with a rifle on a group of people in the East Garfield Park neighborhood, leaving four people injured."
23-07-2022,Renton,Washington,1,6,7,"Seven people were shot, one fatally, shortly after midnight behind a concert hall."
23-07-2022,Pinebluff,North Carolina,1,4,5,"Five people were shot on a road during the early morning, one of whom died."
23-07-2022,Kalamazoo,Michigan,0,9,9,Nine people were shot during a party in the Northside neighborhood.
23-07-2022,Rockford,Illinois,2,2,4,A shooting during a gathering at a closed park left two dead and two others injured.
22-07-2022,Maquoketa,Iowa,4,0,4,"Maquoketa Caves State Park shooting: A man shot and killed three members of a family, including a child, as they were in their tent in Maquoketa Caves State Park before committing suicide in an apparent random attack."
21-07-2022,Los Angeles,California,0,4,4,Two men shot four people standing outside a CVS in the Historic Core.
19-07-2022,Lincoln,Nebraska,0,4,4,"Four people, including a teenager, were shot in the Hartley neighborhood."
18-07-2022,Atlanta,Georgia,0,5,5,"Multiple people opened fire during a gathering in the Thomasville Heights neighborhood in the city's southeast side, wounding five, including at least one teenager."
17-07-2022,Beech Grove,Indiana,1,3,4,"Four people were shot, one fatally, at a park."
17-07-2022,Las Vegas,Nevada,2,2,4,An off-duty North Las Vegas police officer fatally shot his daughter and wounded his son and wife before committing suicide.
17-07-2022,Newark,New Jersey,0,4,4,Four teenagers were shot in the Broadway neighborhood.
17-07-2022,Denver,Colorado,0,7,7,"Seven people were injured in downtown Denver by Denver Police who were ""going after a suspect  claimed to have seen with a gun in a crowded area of the city's downtown."" Six of the seven injured were bystanders. An independent monitor from outside the police department has been setup to investigate the shooting."
17-07-2022,Greenwood,Indiana,4,2,6,"Greenwood Park Mall shooting: A man shot five people, three fatally, inside the food court of Greenwood Park Mall before being fatally shot by an armed civilian."
17-07-2022,Grand Rapids,Michigan,0,4,4,Four people were injured in a shooting outside a bar in the Downtown area of Grand Rapids.
17-07-2022,Milledgeville,Georgia,0,5,5,Five people were shot during a block party.
17-07-2022,Vancouver,Washington,2,2,4,"Two people were killed, and two others injured during a shooting at a crowded house party in the Harney Heights neighborhood."
17-07-2022,New York City,New York,0,4,4,"Four people, including a teenager, were shot in the Brownsville neighborhood of Brooklyn."
17-07-2022,Mount Vernon,Washington,0,5,5,"Five people, including three teenagers, were shot after a fight escalated inside a Walmart."
16-07-2022,North Charleston,South Carolina,0,4,4,Four people were shot in the parking lot of a nightclub during the early morning hours.
16-07-2022,Monroe,Louisiana,0,5,5,"Two teenage brothers opened fire during a memorial, injuring five."
16-07-2022,Philadelphia,Pennsylvania,0,4,4,"Four people, including a teenager, were shot in the Feltonville neighborhood of North Philadelphia."
16-07-2022,Washington D.C.,Washington D.C.,1,3,4,"Four people were shot, one fatally, in the Edgewood neighborhood."
16-07-2022,Houston,Texas,4,0,4,Four people were fatally shot at an apartment complex following an argument.
16-07-2022,Columbus,Ohio,2,2,4,"Two were killed, and two others were injured in a shooting inside a bar in the Hilltop neighborhood."
14-07-2022,Philadelphia,Pennsylvania,0,4,4,Four teenagers were shot near a home in the Poplar neighborhood of North Philadelphia.
14-07-2022,Chicago,Illinois,0,4,4,Four people were injured in a drive-by shooting in the West Garfield Park neighborhood.
13-07-2022,Philadelphia,Pennsylvania,0,4,4,"Four people, including a toddler, were shot in the Mill Creek neighborhood of West Philadelphia."
13-07-2022,Minneapolis,Minnesota,0,4,4,Four people where injured by gunfire in the Folwell neighborhood in the city's north side after an argument ended with shots being fired.
13-07-2022,Indianapolis,Indiana,1,3,4,"Four teenagers were shot at an apartment complex in the Eagledale neighborhood in the city's west side, with one dying."
12-07-2022,Boston,Massachusetts,0,4,4,Four people were shot in the Lower Roxbury neighborhood.
11-07-2022,Memphis,Tennessee,0,4,4,Four people were shot during a shootout at an apartment complex in the Whitehaven neighborhood.
11-07-2022,Jackson,Mississippi,0,4,4,"An argument between two teenagers led to one of them opening fire, leaving four wounded, including the other teenager and a toddler."
11-07-2022,Riverside,Santa Ana,2,3,5,"Two men robbed six 7-Eleven stores and a Yum-Yum Donuts at gunpoint across Southern California during the early morning hours on ""7-Eleven Day"". During the robberies, one of the men shot five people at four of the convenience stores, two of whom died. The man who opened fire is also accused of murdering a homeless man in the North Hills neighborhood of Los Angeles two days earlier."
10-07-2022,Kansas City,Missouri,1,5,6,A shootout between several gunmen and three off-duty police officers working security at a bar just outside it left one dead and five others injured.
10-07-2022,New York City,New York,0,5,5,Five people were shot while on the Coney Island boardwalk in Brooklyn.
10-07-2022,Chicago,Illinois,0,4,4,Four people were shot near a bar in the Near North Side neighborhood during the early morning hours.
10-07-2022,Houghton Lake,Michigan,4,0,4,"A man shot his wife, mother-in-law, and teenage son before fatally shooting himself at their home."
10-07-2022,Crest Hill,Illinois,1,4,5,"While officers dispersed a crowd, a shooting during an informal gathering in a parking lot shortly before midnight left one dead and four others injured."
10-07-2022,Alvin,Texas,1,3,4,One man was killed and three others wounded in a shooting during a party being held at a rental property.
10-07-2022,Downey,California,3,2,5,Three people were killed and two were wounded in a shootout at a house party.
09-07-2022,Jackson's Gap,Alabama,0,4,4,"Four people, including a teenager, were shot while celebrating the city's ""Gap Day""."
08-07-2022,Detroit,Michigan,0,4,4,Four men were injured in a drive-by shooting in the Midtown neighborhood.
08-07-2022,Greensboro,North Carolina,0,4,4,Four people were shot shortly after midnight on a city street.
07-07-2022,Chicago,Illinois,0,4,4,Four people were wounded in a drive-by shooting in the East Garfield Park neighborhood.
06-07-2022,St. Cloud,Minnesota,0,4,4,"An argument in an alleyway escalated into a shooting that injured four, including two teenagers."
06-07-2022,Chicago,Illinois,0,4,4,Four people were shot after three men got out of a car and opened fire on a group of people in the Near West Side neighborbood.
06-07-2022,Tampa,Florida,0,4,4,Four people were shot at an intersection in the Jackson Heights neighborhood.
05-07-2022,Steubenville,Ohio,0,4,4,A shooting inside a nightclub left four injured.
05-07-2022,Youngstown,Ohio,1,3,4,"Four people were shot, one fatally, in the parking lot of an event center in the Lansingville neighborhood during a shootout."
05-07-2022,Gary,Indiana,3,7,10,Shortly after midnight three people were killed and seven injured at a large block party.
05-07-2022,Rochester,New York,1,3,4,"Several people opened fire on a crowd of people gathered at a recreation center, leaving one dead and three others injured."
04-07-2022,Sacramento,California,1,4,5,A shooting outside a nightclub killed one and injured four.
04-07-2022,Shreveport,Louisiana,1,3,4,"Three vehicles engaged in a running gun battle, leaving one dead and three others injured."
04-07-2022,New York City,New York,0,4,4,"Four adults were wounded at a cookout at a home in Rochdale Village, Queens after an unidentified shooter arrived and opened fire. They fled before police arrived."
04-07-2022,Minneapolis,Minnesota,0,7,7,"During a night of civil unrest and several informal Independence Day celebrations, a shooting at Boom Island Park left seven injured."
04-07-2022,Kenosha,Wisconsin,1,4,5,"Five people were shot, one fatally, at a home in the central part of the city."
04-07-2022,Denver,Colorado,1,3,4,A shooting in the College View neighborhood left one dead and three others injured.
04-07-2022,Highland Park,Illinois,7,48,55,"Highland Park parade shooting: Seven people were killed and 48 others were wounded after a person opened fire from a rooftop on people attending an Independence Day parade. Eleven others were injured fleeing the scene. The shooter also admitted he had plans to drive to Madison, Wisconsin to shoot more people. He was charged with a total of 117 counts later in the month."
04-07-2022,Richmond,Virginia,0,6,6,Six people were shot during the early morning outside an internet cafe in the Jackson Ward neighborhood.
04-07-2022,Oakland,California,0,5,5,Five people were hit by celebratory gunfire fired from a nearby neighborhood inside the Oakland Coliseum during a baseball game between the Toronto Blue Jays and Oakland Athletics.
04-07-2022,Chicago,Illinois,0,5,5,"Shortly after midnight, five people, including a teenager, were shot in the Parkway Gardens neighborhood as they stood outside."
04-07-2022,Boston,Massachusetts,0,4,4,Four people were shot at an intersection in the Dorchester neighborhood.
04-07-2022,Kansas City,Missouri,0,4,4,"Officers responding to reports of car break-ins heard gunshots, then found four people shot in the downtown area."
03-07-2022,Surprise,Arizona,3,4,7,A shooter opened fire during a birthday party leaving three men dead and four others wounded.
03-07-2022,Tacoma,Washington,0,4,4,Four people were shot in the South End neighborhood.
03-07-2022,Mullins,South Carolina,0,4,4,Four people were wounded in a shooting.
03-07-2022,Manassas,Virginia,0,4,4,A fight in the parking lot of a car wash escalated into a shooting that left four injured.
02-07-2022,Clinton,North Carolina,0,6,6,A drive-by shooting left four adults and two children hospitalized.
02-07-2022,Haltom City,Texas,3,4,7,"A man shot and killed two people at a home before also shooting a neighbor who was calling the police and then opened fire on three police officers as they approached the residence, wounding all three. The shooter fled the scene and later fatally shot himself."
01-07-2022,Chicago,Illinois,0,4,4,"A man opened fire on people on a street in the West Garfield Park neighborhood, leaving four injured."
01-07-2022,Greenwood,Mississippi,1,7,8,A drive-by shooting left one dead and seven others injured.
01-07-2022,New York City,New York,1,3,4,"A shooter opened fire inside a mechanic shop that was hosting a party in the Richmond Hill neighborhood of Queens, leaving one dead and three others injured."
01-07-2022,Chicago,Illinois,2,3,5,An argument outside a nightclub escalated into a shooting that left two dead and injured three others in the Chicago Loop.
30-06-2022,Newark,New Jersey,0,9,9,Nine people were injured in a shooting.
30-06-2022,Allen City,Kentucky,3,4,7,"2022 shooting of Kentucky police officers: A man shot dead three police officers and a police dog and wounded four other people, including three officers."
29-06-2022,Jersey City,New Jersey,0,4,4,Four people were injured in a shooting in the Greenville neighborhood.
29-06-2022,Philadelphia,Pennsylvania,0,4,4,Four people were shot in the East Germantown neighborhood of Northwest Philadelphia.
28-06-2022,Ripley,Tennessee,1,3,4,One person was fatally shot and two others were injured after a teenager violently forced his way into a home and opened fire. The shooter was also wounded.
27-06-2022,Holly Springs,Mississippi,1,3,4,One person was killed and three others were injured during a shootout on MS-178.
27-06-2022,Charlotte,North Carolina,0,5,5,"Five people, included two children, were shot in the Lincoln Heights neighborhood."
26-06-2022,Sutherlin,Virginia,1,7,8,An early morning shooting at a party left one dead and seven others injured.
26-06-2022,Tacoma,Washington,0,8,8,Eight people were shot at a party in South Tacoma.
26-06-2022,Paterson,New Jersey,0,5,5,Five people were wounded after a shooting.
26-06-2022,Blakely,Georgia,1,6,7,One person was killed and six others wounded after a shooting.
26-06-2022,Tacoma,Washington,1,4,5,"Five people were shot, one fatally."
26-06-2022,Winona,Texas,0,5,5,Five people were shot at a trail ride concert.
26-06-2022,San Antonio,Texas,1,3,4,"During the early morning, a fight at a nightclub escalated into a shootout that left one dead and three injured."
25-06-2022,Minneapolis,Minnesota,0,4,4,"After multiple fights broke out during a gathering, a shooting left four injured, including several uninvolved bystanders, during the late evening hours."
25-06-2022,Houston,Texas,2,2,4,Two men were killed and another two wounded after an argument escalated into a shooting.
25-06-2022,New York City,New York,0,4,4,"Four people, including an eight-year-old boy, were wounded after a man on a dirtbike opened fire on a barbeque in the Bedford-Stuyvesant neighborhood of Brooklyn."
24-06-2022,Hopewell,Virginia,2,2,4,"Four teenagers were shot near railroad tracks, two fatally."
24-06-2022,Philadelphia,Pennsylvania,2,2,4,Two were killed and two others wounded after a shootout in the Point Breeze neighborhood.
24-06-2022,Burleson,Texas,1,3,4,A shooting killed a woman driving nearby and wounded three others. Six were arrested in connection with the shooting.
23-06-2022,Chicago,Illinois,1,3,4,"Four people were shot, one fatally, near a CTA Red Line station."
20-06-2022,New York City,New York,1,8,9,"One person was killed, and eight others wounded at a late night barbeque party in a park in Harlem."
20-06-2022,New York City,New York,0,5,5,Five people were shot at a party in the St. George neighborhood of Staten Island.
19-06-2022,Miami,Florida,0,5,5,"Five people, including a teenager, were shot while in a car at an intersection between the Coral Way and Coconut Grove neighborhoods."
19-06-2022,Walterboro,South Carolina,2,2,4,"Two people were killed, and two others injured during a shooting at a nightclub."
19-06-2022,Grand Rapids,Michigan,0,4,4,Four people were shot in the Burton Heights neighborhood in the city's southeast side.
19-06-2022,Detroit,Michigan,1,3,4,"Four people were shot, one fatally, at an apartment complex and a park in two connected shootings in the Krainz Woods neighborhood."
19-06-2022,Washington D.C.,Washington D.C.,1,3,4,"A teenager was killed and three others, including a police officer, were shot during a concert celebrating Juneteenth in the Cardozo neighborhood."
18-06-2022,San Antonio,Texas,2,5,7,"A family having a barbeque in their front yard was fired upon in a drive-by shooting, leaving two dead and five injured."
18-06-2022,Baltimore,Maryl,0,4,4,Three people standing together in the Sandtown-Winchester neighborhood were shot. A fourth person who was driving by was also hit by gunfire.
18-06-2022,Pensacola,Florida,0,5,5,Just after midnight five people were shot at a nightclub in Downtown Pensacola.
17-06-2022,Chicago,Illinois,0,5,5,"A group of people standing in a parking lot in the Lake Meadows neighborhood were fired upon, leaving five injured."
16-06-2022,Oakland,California,1,4,5,"Five people were shot, one fatally, in the Civic Center neighborhood."
15-06-2022,Denmark,South Carolina,0,4,4,"Four people, including at least one teenager, were shot."
14-06-2022,Casselberry,Florida,4,0,4,"Four people, including a child, were fatally shot in a murder-suicide at an apartment complex."
14-06-2022,Claremont,North Carolina,1,3,4,"A man shot fatally a woman and injured her two adult children over an argument about repairing a sink. After shooting them, he shot himself in the foot."
12-06-2022,Indianapolis,Indiana,0,5,5,"A teenager shot four people during an argument, leaving one paralyzed, before being shot herself."
12-06-2022,Los Angeles,California,3,4,7,Three people were killed and four others injured during a shooting at a rapper's birthday party concert in the Boyle Heights neighborhood. Two security guards were wounded.
12-06-2022,Denver,Colorado,2,4,6,"Six people were shot, two fatally, during a party in the Virginia Village neighborhood."
12-06-2022,Austin,Texas,1,3,4,An argument in the Los Indios neighborhood led to a shooting that killed one and injured three others.
12-06-2022,New Orleans,Louisiana,0,4,4,Four people were shot outside a bar in the Mid-City neighborhood.
12-06-2022,Roseville,Michigan,0,4,4,A domestic incident escalated into a shooting that injured four.
12-06-2022,Gary,Indiana,2,4,6,A shooting at a nightclub left two dead and four others wounded.
11-06-2022,Nashville,Tennessee,2,2,4,"Two people were shot, two fatally, during a birthday pool party at an apartment complex."
11-06-2022,Louisville,Kentucky,0,5,5,Five teenagers were shot near the Big Four Bridge.
11-06-2022,Chicago,Illinois,1,4,5,Five people in an alleyway in the Auburn Gresham neighborhood were shot in a drive-by shooting. One victim later died of their injuries.
11-06-2022,Detroit,Michigan,0,4,4,Four people were injured in a drive-by shooting during a bachelor party being hosted at an Airbnb in the Davison-Schoolcraft neighborhood in the city's northwest side.
11-06-2022,South Fulton,Georgia,0,7,7,Seven people were shot during a party.
10-06-2022,Decatur,Georgia,1,3,4,An argument at a restaurant led to a shooting that left one person dead and three others injured.
09-06-2022,Smithsburg,Maryl,3,3,6,"A shooter opened fire at a manufacturing facility, killing three and injuring one before fleeing the scene. Responding officers spotted the fleeing suspect, who engaged in a gun battle with state troopers, leaving the suspect and a state trooper injured."
08-06-2022,Yuma,Arizona,0,4,4,A gunfight between two cars left four injured.
07-06-2022,Baltimore,Maryl,2,2,4,"Four men sitting in the side yard of a house in the Frankford neighborhood were fired upon by a shooter. Two were killed, and the other two were wounded."
07-06-2022,Chicago,Illinois,0,4,4,Four people were shot on a sidewalk in the North Lawndale neighborhood.
07-06-2022,Portsmouth,Virginia,4,0,4,Four people were fatally shot at a home. The fourth victim succumbed to their injuries after a few days.
07-06-2022,Chicago,Illinois,0,4,4,"Four people, including a teenager, were shot near a courtyard in the Altgeld Gardens neighborhood."
06-06-2022,Salt Lake City,Utah,1,3,4,"Four people were shot, one of them fatally, at an apartment complex after a fight escalated."
05-06-2022,Andrews,South Carolina,0,4,4,Four people were injured in a drive-by shooting shortly before midnight.
05-06-2022,Saginaw,Michigan,3,2,5,Three people were killed and two were wounded by an early morning shooting at a house. The child of a dead pregnant woman was soon delivered by doctors.
05-06-2022,Mesa,Arizona,2,2,4,Two people were killed and two others injured in a shooting outside a nightclub.
05-06-2022,Chattanooga,Tennessee,2,12,14,"2022 Chattanooga shooting: Fourteen were shot, two of them fatally, at a nightclub during the early morning. A third person was killed by a vehicle attempting to flee."
05-06-2022,Grand Rapids,Michigan,1,3,4,One person was killed and three others injured in an early morning shooting at the Festival of the Arts.
04-06-2022,Socorro,Texas,0,5,5,Five teenagers were wounded in a targeted shooting at an early morning graduation house party after two groups at the party began fighting.
04-06-2022,Summerton,South Carolina,1,7,8,"Eight people, including six children, were shot during a graduation party after occupants in two cars opened fire at the partygoers in the yard of the house it was being held at. An adult woman was killed."
04-06-2022,Hempstead,New York,1,3,4,A man was fatally shot and three others were wounded beside an apartment building.
04-06-2022,Macon,Georgia,1,3,4,"Four people were shot, one fatally, at an abandoned home."
04-06-2022,Enterprise,Nevada,0,4,4,A couple was arrested after the boyfriend shot three people during an argument. The boyfriend was also shot.
04-06-2022,Philadelphia,Pennsylvania,3,11,14,"2022 Philadelphia shooting: Fourteen people were shot, three of them fatally, by multiple shooters on South Street. One of the shooters may have been shot by a responding police officer."
04-06-2022,Phoenix,Arizona,1,8,9,"A fight during a party being held at a strip mall escalated into gunfire, with nine people being shot."
03-06-2022,Omaha,Nebraska,1,3,4,"Four people were shot, one fatally, shortly before midnight near an apartment complex."
03-06-2022,Chester,Virginia,1,5,6,"Six people were shot, one fatally, during a party. One of the shooting victims also suffered a broken arm."
03-06-2022,Birch River,West Virginia,2,2,4,"Two police officers responding to a domestic disturbance were fired upon by two men. In the ensuing gun battle, a shooter and a police officer were killed. The surviving officer and shooter were both shot."
02-06-2022,Centerville,Texas,5,0,5,"Centerville shooting: An escaped prisoner broke into the holiday home of a grandfather and his four grandchildren and fatally shot four of them, as well as fatally stabbing one of the grandchildren, before stealing their truck. The prisoner was fatally shot in a gun battle with police later the same day."
