Date,City,State,Dead,Injured,Total,Description
23-08-2020,New York City,New York,1,3,4,A man was killed and three others wounded in a housing complex in Brooklyn in the early morning.
23-08-2020,Pine Bluff,Arkansas,0,7,7,Seven people were wounded when gunfire erupted while a large crowd was gathered outside a gas station early in the morning.
22-08-2020,Rockford,Illinois,1,3,4,Shortly before midnight one man was killed and three others injured.
22-08-2020,Hueytown,Alabama,1,3,4,One person was killed and three wounded after an early morning shooting near the Allison Bonnet Memorial Drive.
19-08-2020,Philadelphia,Pennsylvania,0,4,4,A gun fight wounded two adults and two seventeen-year-olds in West Philadelphia.
19-08-2020,Chicago,Illinois,0,6,6,Five adults and a seventeen-year-old were wounded after a man stepped out of a vehicle and opened fire on a large gathering. The shooting took place in Gresham in the South Side.
18-08-2020,Philadelphia,Pennsylvania,1,4,5,A man was killed and four others wounded including a fifteen-year-old in the Strawberry Mansion neighborhood.
18-08-2020,New York City,New York,0,4,4,A car drove up to a Ravenswood Public Housing building in Queens and opened fire. A seventeen-year-old boy and three adults were wounded.
18-08-2020,Rockford,Illinois,0,4,4,Four people were wounded in the early morning at a large gathering in Twin Sisters Park.
17-08-2020,New York City,New York,0,4,4,Four men were wounded in an early morning shooting in Brooklyn. The suspected gunman fled in a car after opening fire.
17-08-2020,Louisville,Kentucky,2,2,4,Two people were killed and two people were wounded in a shooting late at night before the car they were in crashed.
17-08-2020,Cleveland,Ohio,0,5,5,Five people were wounded at Dove Park in an evening drive-by shooting.
17-08-2020,Dayton,Texas,3,2,5,"A man is accused of killing his ex-girlfriend, a man in her home, and a neighbor and wounding two others. He was later arrested after hiding in the surrounding woods."
16-08-2020,Lexington,Kentucky,1,3,4,An eighteen-year-old was killed and three others wounded after a disturbance occurred at a large gathering.
16-08-2020,Oklahoma City,Oklahoma,0,4,4,Four people were wounded at a large birthday party in the parking lot.
16-08-2020,Cincinnati,Ohio,1,3,4,"Responding officers found a man wounded shortly after midnight, who later died at the hospital. Three others arrived by private vehicles to the hospital."
16-08-2020,Denver,Colorado,2,5,7,Two men were killed and five others were wounded in a shooting shortly after an earlier shooting.
16-08-2020,Cincinnati,Ohio,2,9,11,One person died at the scene and one later at the hospital with nine others wounded in an early morning shooting.
16-08-2020,San Antonio,Texas,0,5,5,"Five people were injured, one critically, in a shooting caused by a dispute at a flea market. A security guard returned fire."
15-08-2020,Philadelphia,Pennsylvania,0,5,5,Four adults and a sixteen-year-old boy were injured shortly before midnight at a large block party when a group on motorcycles arrived and opened fire.
15-08-2020,Rochester,New York,0,5,5,Five people were wounded shortly before midnight.
15-08-2020,Belleville,Michigan,4,0,4,"Two men and two women were killed in a home, with one of the women killed identified as the shooter's former fiancée. The shooter boasted about the killings on social media and text messages before being arrested."
15-08-2020,New Haven,Connecticut,1,5,6,One man was killed and five injured after a dice game grew violent shortly before midnight.
15-08-2020,Troy,Alabama,2,3,5,Officers arrived at a large gathering early in the morning to disperse it. While doing so shots were fired in the apartment complex's parking lot. Two men were killed and three others wounded.
14-08-2020,New York City,New York,0,4,4,Three women and one man were wounded late at night on Lenox Avenue in Harlem.
12-08-2020,Lacombe,Louisiana,2,3,5,A group of four men attempted to rob a home at gun point. The home owner opened fire in defense and killed two of the robbers and wounded the other two. The homeowner's four-year-old child was also wounded.
11-08-2020,Nashville,Tennessee,0,8,8,Eight people and a dog were injured in a shooting on Commerce Street in the early hours of the morning.
11-08-2020,Virginia Beach,Virginia,0,4,4,Two adults and two children under the age of twelve were wounded in a gated apartment complex.
10-08-2020,Philadelphia,Pennsylvania,1,6,7,At least two gunmen opened fire on a group of people in the city's Frankford neighborhood. One man was killed and six others wounded.
09-08-2020,Baltimore,Maryl,0,5,5,Five people including a seventeen-year-old were injured while playing a dice game when a vehicle pulled up and opened fire.
08-08-2020,Philadelphia,Pennsylvania,0,6,6,"A pregnant woman, three teenagers and two other women were wounded. They were a part of a large BBQ gathering at a public park."
08-08-2020,Albany,New York,1,3,4,"A 18-year-old man was killed and a 22-year-old, 28-year-old, and 29-year-old were injured in a drive by shooting involving multiple suspected perpetrators."
08-08-2020,Paducah,Kentucky,1,4,5,Shortly before midnight a man was killed and four others wounded in the city's north side.
08-08-2020,Brockton,Massachusetts,0,5,5,Five men were wounded at a house party which was detected by the city's gunshot detection system. Prior a woman from the same party was stabbed.
08-08-2020,Birmingham,Alabama,1,5,6,"A man was killed and five people, including an off-duty Birmingham Police officer, were wounded at a motorcycle club in Ensley. The shooting was reported to be due to an altercation escalating, with some of the victims innocent bystanders."
06-08-2020,Memphis,Tennessee,0,4,4,A home was shot at first then after police investigated the shooters return and opened fire. Four people were injured in the second shooting including an 18-month-old infant.
06-08-2020,New York City,New York,0,4,4,"A woman, two men and a 17-year-old were wounded after an argument escalated in Brooklyn. The shooter fled the scene."
04-08-2020,Greenwood,South Carolina,1,3,4,A 19-year-old was killed and three others individuals were wounded at an apartment complex.
04-08-2020,Detroit,Michigan,0,4,4,One man and three women were injured after an altercation escalated. A male shooter escaped the scene and a female was arrested for pointing a weapon at one of the wounded.
04-08-2020,Anchorage,Alaska,0,4,4,Police responding to a call of shots fired found one person wounded and an additional three connected to the shooting were found in local hospitals.
03-08-2020,South Holland,Illinois,0,4,4,"Four men were wounded in a vehicle on Bishop Ford Freeway, after another vehicle's occupant fired on them."
03-08-2020,Milwaukee,Wisconsin,1,3,4,An early morning argument escalated and resulted in one man killed and three injured outside a local business.
03-08-2020,Ceres,California,1,3,4,"Police responded to reports of a shooting and discovered three wounded individuals, one of whom later died. A fourth victim arrived at a hospital in a private vehicle."
03-08-2020,Rosedale,Maryl,1,5,6,"A 13-year-old boy was killed, five others were wounded; a 14-year-old boy and girl, two 12-year-old boys and a 19-year-old man were wounded. The group was shot at in a parking lot after an altercation while attending a Triple Threat Elite Dance event."
02-08-2020,Houston,Texas,1,3,4,A 29-year-old rap artist was killed and three others were wounded in a shooting in North Houston. The wounded victims' conditions are unknown. The suspects are gang members according to the chief of police.
01-08-2020,Bay Saint Louis,Mississippi,2,2,4,Two people were killed and two injured in a random ambush style shooting. The perpetrator was arrested after arriving at his mother's house covered in blood.
31-07-2020,Philadelphia,Pennsylvania,1,3,4,A woman was killed and three men were wounded in an evening shooting.
30-07-2020,Tampa,Florida,0,5,5,A man opened fire at a gas station while screaming at passersby. He wounded five people before he was arrested.
30-07-2020,Miami Gardens,Florida,0,5,5,Five men were wounded after a potentially gang related shooting occurred behind a U-Gas Station. A witness likened the amount of gunfire to the Iraq war.
29-07-2020,Detroit,Michigan,0,4,4,Three men and a woman were injured while standing outside and a person opened fire from a car.
29-07-2020,Elyria,Ohio,5,0,5,"A man killed his wife and three children, aged 12, 10 and 6-years-old, and then himself in an apparent murder-suicide."
29-07-2020,St. Louis,Missouri,3,1,4,Three men were killed and a third injured after an afternoon dispute escalated between two groups of people.
28-07-2020,Milwaukee,Wisconsin,0,4,4,Four men were injured in the evening.
28-07-2020,Wilmington,Delaware,2,2,4,A 17-year-old and a woman were killed and two men were injured in a shooting.
27-07-2020,Federal Way,Washington,1,3,4,A 17-year-old was killed and two adults and a 12-year-old injured at Steel Lake Park. A woman reportedly opened fire after an argument.
27-07-2020,Chicago,Illinois,1,4,5,Five people were sitting on a porch in the evening when one was killed and four injured in a drive-by shooting.
26-07-2020,Flint Township,Michigan,1,3,4,"One person was killed and three others were injured when two men opened fire in a restaurant. One man was charged with open murder, three counts of assault with intent to murder and multiple weapons charges. The other man was charged with careless discharge of a firearm."
26-07-2020,Commerce City,Colorado,1,3,4,Responding officers to a large gathering in the early morning found a man dead. Three additional victims were transported in private vehicles to the hospital.
26-07-2020,Louisville,Kentucky,1,3,4,"Officers responded to I-64 West in the early morning after calls of shots fired by a moving vehicle. They found four individuals shot, with one dead, in a crashed car. A fifth individual was wounded when the car crashed."
26-07-2020,Mont Enterprise,Texas,0,4,4,Four people were injured shortly after midnight when someone opened fire during the Rude Boyz Annual Trail Ride. The gathering was held at Durango's Canyon.
26-07-2020,Magnolia,Arkansas,0,4,4,Four people were injured in the early morning after at least two semi-automatic handguns were fired at a large house party.
25-07-2020,Denver,Colorado,2,3,5,Two men were killed and two woman and a man were wounded in the Park Hill neighborhood.
25-07-2020,Manteca,California,0,7,7,Officers responded from a traffic stop after hearing gunfire. They discovered seven people wounded at a large house party after a man armed with a semi-automatic weapon arrived and opened fire.
25-07-2020,Miami,Florida,1,3,4,"A seven-year-old girl, a sixteen-month boy and two adults were shot by a passing vehicle while getting out of a car. The girl was declared brain dead at the hospital, causing the shooting to be declared a homicide."
25-07-2020,Dallas,Texas,0,4,4,"Three men and a woman were injured shortly before midnight. A man was denied entry at a local bar, retrieved an assault-type weapon from his car, and shot into the building."
25-07-2020,Raleigh,North Carolina,0,4,4,A woman and three men were wounded near a local restaurant.
25-07-2020,Flint,Michigan,0,6,6,"Six people were shot at a party of over 1,000 people following the filming of a music video in a parking lot."
24-07-2020,Atlanta,Georgia,2,2,4,"Two adults were killed and two teenagers, aged seventeen and eighteen, were injured in an early morning shooting. The group were ambushed by two shooters after arriving at an AirBnb house party in a rideshare."
23-07-2020,Chicago,Illinois,2,4,6,Two people were killed and four injured while standing on the sidewalk in the West Pullman area of the Far South Side.
23-07-2020,Henrico County,Virginia,1,3,4,One man was killed and three others injured in the early morning. Officers are investigating if the individuals were a part of an announced party for that night.
23-07-2020,Petersburg,Virginia,0,4,4,Four people were wounded in an early morning shooting.
22-07-2020,Warren,Michigan,0,4,4,A man opened fire and others returned fire at a large party with at least one hundred people in attendance. Four people were injured in the shooting.
21-07-2020,Chicago,Illinois,0,15,15,"Fifteen people were injured, four critically, after a shooter opened fire at people leaving a funeral home in Chicago's Auburn Gresham neighborhood."
20-07-2020,Chicago,Illinois,0,5,5,Five people were wounded in the North Lawndale neighborhood. They were a part of people gathered on the sidewalk when a car pulled up and several men got out and opened fire.
20-07-2020,Richmond,Virginia,1,4,5,One man was killed and four others injured after a fight in a McDonald's parking lot escalated. One of the injured was an innocent bystander in the Food Lion parking lot across the street.
19-07-2020,Peoria,Illinois,0,13,13,Thirteen people were injured in an early morning shooting at a riverfront gathering. An argument between two women led to a man firing two shots into the air. This led to multiple individuals opening fire on the crowd.
19-07-2020,Detroit,Michigan,0,4,4,"Two fifteen-year-olds and two seventeen-year-olds were wounded while sitting in traffic when another car pulled up and opened fire. Four days later, the suspect was shot by police after a pursuit in which he was found holding a gun and died at a hospital."
19-07-2020,Detroit,Michigan,3,1,4,"A man opened fire in a restaurant, killing three men and injuring another. The shooter has been taken into custody."
19-07-2020,Chicago,Illinois,2,3,5,"Two people were killed and three wounded shortly before midnight in Morgan Park on the Far South Side. They were part of a group of people, that were fired upon by an unknown shooter."
19-07-2020,Washington D.C.,Washington D.C.,1,8,9,Police responding to reports of a shooting discovered one man killed and eight other adults wounded.
19-07-2020,Omaha,Nebraska,0,8,8,Eight people including a fifteen-year-old girl were injured in a drive by shooting early in the morning.
18-07-2020,Chicago,Illinois,1,4,5,A man was killed and four others wounded after two men opened fire in the early morning in the North Lawndale neighborhood. The men were standing on a street corner.
17-07-2020,Madison,Florida,0,4,4,"Three adults and a child were injured after a man, out on bond from a January arrest, entered their home and opened fire."
17-07-2020,Columbus,Ohio,0,4,4,Four adults were wounded while attending a memorial in Weinland Park. A three-year-old girl was also wounded when bullets struck the home she was in.
16-07-2020,Nashville,Tennessee,0,5,5,"Eight or nine people opened fire in the early morning in a drive-by shooting. Five people were wounded, including a juvenile."
15-07-2020,New York City,New York,1,5,6,Two gunmen opened fire in the early morning outside a Brooklyn apartment building. A man was killed and five other adults were wounded.
15-07-2020,Shreveport,Louisiana,1,3,4,A man was killed and two adults and an 11-year-old child were injured after an argument escalated from an original argument at a basketball court.
14-07-2020,St. Joseph,Missouri,0,5,5,Five men were injured while standing in a park after a vehicle drove by and opened fire.
14-07-2020,Durham,North Carolina,0,8,8,Six adults and two children aged four and eight-years-old were wounded after someone opened fire at a party outside a home.
13-07-2020,New York City,New York,0,6,6,Multiple shooters traveled across three different blocks and wounded six people in Brooklyn.
13-07-2020,Louisville,Kentucky,1,3,4,"A 16-year-old was killed and three others, including two juveniles, were wounded at a gas station."
13-07-2020,Kent,Washington,0,6,6,Five adults and a teenager were wounded after an argument escalated at a Metro bus stop.
11-07-2020,Rock Hill,South Carolina,1,3,4,One individual was killed and three injured inside a local bar shortly after midnight.
11-07-2020,Ogden,Kansas,0,4,4,Four men were wounded outside a local bar shortly before midnight.
10-07-2020,New York City,New York,1,3,4,One man was killed and three injured in an evening shooting at a Brooklyn building. Neighbors claim that the building was a local gambling den.
10-07-2020,Anchorage,Alaska,1,4,5,A man was killed and one man and three women were injured in an early morning shooting at a house party. Two teenagers were arrested and charged for the shooting.
09-07-2020,Aguanga,California,7,0,7,A shooting at a large marijuana grow house left seven people dead.
09-07-2020,Chicago,Illinois,1,3,4,An eight-year-old girl was killed and three others injured when another vehicle opened fire on them while they were sitting in another car in the Canaryville neighborhood.
09-07-2020,New York City,New York,0,5,5,"A fifteen-year-old shooter opened fire at a group of people in a drive-by shooting, including a six-year-old in Brooklyn. Police believe the shooting to be gang related."
09-07-2020,New Orleans,Louisiana,0,4,4,Four people including a fourteen-year-old boy were injured in Central City.
09-07-2020,Indianapolis,Indiana,1,4,5,An eighteen-year-old was killed and four others injured after a fight broke out during a party in the Butler-Tarkington neighborhood over a broken table.
07-07-2020,Alexandria,Virginia,0,5,5,Shortly after midnight an individual stormed an apartment and wounded a man and four teenagers aged 14 to 19-years-old.
07-07-2020,Paterson,New Jersey,4,3,7,"In a late night shooting, four people were killed and three injured. Officers suspect the shooting was retaliation by people recently released from prison."
06-07-2020,Hope,Arkansas,0,6,6,Six people between 15 and 21-years-old were wounded in the early morning during an social gathering. A seventh individual broke her leg running from the gunfire.
06-07-2020,Dyersburg,Tennessee,0,5,5,Five people were wounded inside the local American Legion club in the early morning. All individuals are refusing to speak with police.
06-07-2020,Chicago,Illinois,1,3,4,Officers responding to a shots fired call discovered four wounded victims. One victim later died at the hospital and the other three are uncooperative with investigators.
06-07-2020,Sikeston,Missouri,2,7,9,Two women were killed and seven other individuals wounded at a house party after a drive-by shooting early in the morning.
06-07-2020,Chicago,Illinois,0,6,6,Six men were wounded in a late night drive by shooting while standing on the sidewalk.
05-07-2020,Baltimore,Maryl,0,4,4,Four men were discovered shot on the city's west side in the evening.
04-07-2020,Chicago,Illinois,1,3,4,"One man was killed and three other individuals wounded, including a 5-year-old, after an individual exited an alley way and opened fire on the group. One of the group likely returned fire at the shooter."
03-07-2020,Chicago,Illinois,0,7,7,Six men and a woman were injured in a drive-by shooting after leaving a house party after a fight broke out in the Greater Grand Crossing neighborhood.
03-07-2020,Cleveland,Ohio,1,17,18,Seventeen people were wounded and one killed after a shootout between multiple motorcycle clubs after a fight at one of the club's headquarters caused many to be thrown out.
03-07-2020,Albuquerque,New Mexico,0,4,4,Three adults and one child were injured by a shooter while exiting a house party. The shooter was later arrested.
02-07-2020,Waco,Texas,1,3,4,One man was killed and three others were wounded in a shooting outside and inside a home in Waco. Two of the victims were transported to a hospital by ambulance and were listed in critical condition. The third victim self applied to the hospital but his condition was unknown. Police believe that the motive behind the shooting is the sale of illicit drugs gone wrong.
30-06-2020,Greenbrier,Arkansas,0,4,4,"Three adults and one juvenile were wounded, after going to a residence and getting into an altercation. The shooter was a juvenile resident of the home."
30-06-2020,Boston,Massachusetts,1,3,4,Officers responding to a call of shots fired discovered four wounded individuals. A man later died at the hospital.
30-06-2020,Davenport,Iowa,0,5,5,Five men were wounded in an evening shooting. Officers believed the shooting was targeted at the group.
30-06-2020,Atlanta,Georgia,1,4,5,"Early in the morning, a group of men sitting on the sidewalk were shot at in a drive-by. One man was killed and four injured."
30-06-2020,Chicago,Illinois,0,4,4,Shortly after midnight three men and a woman were shot while waiting in a vehicle at a Shell gas station in River North neighborhood. The shooter was in and later fled in a red sedan.
30-06-2020,Dayton,Ohio,0,4,4,Three men and one women were all wounded in a shooting.
29-06-2020,Sioux Falls,South Dakota,1,3,4,"A man shot and killed another man in a home, after mistaking it as the home of his intended target. He left and entered the correct home and wounded three others."
29-06-2020,Los Angeles,California,0,4,4,Four men were wounded in a public park in Sylmar in a drive-by shooting.
28-06-2020,Sawyerville,Alabama,0,7,7,"During an early morning field party, seven people were wounded after an argument between two men escalated."
28-06-2020,Philadelphia,Pennsylvania,2,2,4,Two men were killed and two injured in a late night shooting in the Kensington neighborhood.
27-06-2020,Blytheville,Arkansas,3,1,4,"A Missouri man traveled to the area for a house party, where a couple got into a physical domestic fight. Shortly after 911 was called in response to that fight the man opened fire and killed his Uncle and two others, and wounded another."
27-06-2020,Roselle,Illinois,1,4,5,"During a party at a rented house, 4 people were wounded and one person was killed when one person began firing a handgun inside the home, and then several people began firing handguns inside the home. Police revealed that over 60 gunshots were fired at the scene."
27-06-2020,Red Bluff,California,2,4,6,Red Bluff shooting. An employee was killed and four injured at a Walmart distribution center. The perpetrator was later killed in a shootout with responding police.
27-06-2020,Chicago,Illinois,1,3,4,A man was killed and three others wounded after a large gathering in Douglas.
27-06-2020,New York City,New York,0,4,4,"Early in the morning a man opened fire at a house party in Brooklyn, and injured four people."
27-06-2020,Peoria,Illinois,0,4,4,Officers responding to an early morning ShotSpotter alert found two men wounded and identified two women who arrived at the hospital to be a part of the incident.
26-06-2020,Aurora,Colorado,0,5,5,Five people were wounded by a shooter outside a local grocery store. Officers previously thought the incident was a gunfight but later announced it was one shooter.
26-06-2020,Fresno,California,0,4,4,"Four people were wounded at a house party shortly before midnight, after two shooters appeared near a neighboring home."
26-06-2020,Phoenix,Arizona,0,4,4,"Three adults and a 14-year-old boy were wounded in the early morning at a gas station. Prior to the shooting, a large crowd of people and cars had been gathered around the gas station."
25-06-2020,Philadelphia,Pennsylvania,0,4,4,Four men were wounded after a shooting at an intersection in the Kensington neighborhood.
25-06-2020,Bridgeport,Connecticut,1,3,4,"A man was killed, and two adults and a 17-year-old injured while attempting to make a rap music video. Officers believed the shooting was targeted, as the victims refused to cooperate."
24-06-2020,Jackson,Tennessee,0,4,4,Three adults and one juvenile were wounded in an early morning shooting. The suspected shooter was arrested.
23-06-2020,Lake Worth Beach,Florida,0,5,5,Five people were wounded in a drive-by shooting during the evening. Responding police believed the shooter and victims know each other.
23-06-2020,Chicago,Illinois,0,4,4,"Four people were wounded in a drive by shooting in Burnside, while standing on a porch."
22-06-2020,Chicago,Illinois,0,4,4,Four people were wounded early in the morning after an individual opened fire from a vehicle in the Back of the Yards neighborhood on the South Side.
22-06-2020,San Francisco,California,0,5,5,Police discovered five men wounded by gunfire in the Tenderloin neighborhood.
22-06-2020,Minneapolis,Minnesota,0,4,4,Four people were wounded in the Willard-Hay neighborhood during the afternoon.
22-06-2020,Charlotte,North Carolina,3,6,9,"Officers responding to a block party on reports of someone being hit by a car arrived to shots being fired. Three people were killed and six injured by gunfire, with an additional five injured after being hit by cars while attempting to flee."
22-06-2020,Minneapolis,Minnesota,0,4,4,Officers responding to a shooting on West Broadway Avenue discovered four people injured.
22-06-2020,Chicago,Illinois,0,5,5,"Five people were wounded in a drive-by, including a 16-year-old girl, at an early morning gathering in East Garfield Park."
22-06-2020,New York City,New York,0,5,5,Five people were shot during a vigil in the Crown Heights area of Brooklyn in the evening.
21-06-2020,Auburn,Alabama,0,4,4,"Shortly after midnight, officers responded to a home after a complaint of gunshots. They discovered four men wounded."
21-06-2020,Minneapolis,Minnesota,1,11,12,"A group of people fired into a crowd, killing one and injuring 11 others."
21-06-2020,Austin,Texas,0,5,5,Five people were wounded in an early morning shooting.
21-06-2020,Milwaukee,Wisconsin,1,4,5,Early in the morning a shooting occurred at a house party. Five individuals were shot and one died on the way to the hospital in a private vehicle.
21-06-2020,Chicago,Illinois,1,3,4,An argument in Humboldt Park escalated shortly after midnight. A man was killed and three wounded.
21-06-2020,Buffalo,New York,0,4,4,Four men were wounded after a shooting at an early morning gathering of cars.
